,tool_name,api_name,instruction,type
548,tourist_attraction,search,I need to know how much it costs to enter those places in CNY.,3
549,tourist_attraction,search,What are some interesting places to visit in London in English?,3
550,tourist_attraction,detail,Can you give me more details about the Statue of Liberty?,3
551,tourist_attraction,detail,Can you provide more information about the Eiffel Tower?,3
552,tourist_attraction,detail,Can you give me some information about a certain tourist spot in English?,3
553,tourist_attraction,detail,"I am planning my schedule currently, could you present some details of tourist attractions in Mandarin?",3
554,tourist_attraction,detail,Can you deliver details of a certain tourist destination and present the costs in Euros?,3
555,tourist_attraction,detail,"I am budgeting for a tour, could you provide data about some famous tourist attractions using the British Pound as the currency?",3
556,tourist_attraction,detail,Can you provide details about the Great Wall of China in German?,3
557,tourist_attraction,detail,I want to know more about the Leaning Tower of Pisa in Italian language.,3
558,tourist_attraction,detail,Could you give me details of the Sydney Opera House with the cost in dollars?,3
559,tourist_attraction,detail,Could you give me the information about a popular tourist site in Mandarin with prices in Yen?,3
560,tourist_attraction,photos,Could you show me the photos of the Eiffel Tower with descriptions in French?,3
561,tourist_attraction,photos,I want to see some photos of the Great Wall. The explanation should be in Mandarin.,3
562,tourist_attraction,photos,How much does it cost to visit the Colosseum in euros?,3
563,tourist_attraction,photos,Show me a photo of the Grand Canyon and tell me the admission fee in USD.,3
564,tourist_attraction,photos,What are the standard prices for popular attractions in Germany in euros? Can you provide details in German?,3
565,tourist_attraction,photos,Tell me the costs of touring attractions in Japan in Yen. Please provide the information in Japanese.,3
566,tourist_attraction,photos,Can you show me some photos of London Eye?,3
567,tourist_attraction,photos,I want to see how the Sydney Opera House looks like.,3
568,tourist_attraction,photos,Could you provide some pictures with Italian descriptions?,3
569,tourist_attraction,photos,I wish to view photos with detailed descriptions in Spanish.,3
570,tourist_attraction,reviews,Can I see the reviews in English for the attraction with ID: 12345?,3
571,tourist_attraction,reviews,What's being said in Mandarin about the Eiffel Tower?,3
572,tourist_attraction,reviews,Any German reviews available for the tourist spot with ID: 67890?,3
573,tourist_attraction,reviews,"Are there reviews mentioning prices for the Great Wall of China, and can they be shown in Euros?",3
574,tourist_attraction,reviews,What do visitors say about the attraction with ID: 11122?,3
575,tourist_attraction,reviews,Can you show me reviews for Disneyland?,3
576,tourist_attraction,reviews,Are there Russian reviews with prices in RMB available?,3
577,tourist_attraction,reviews,Any reviews in Spanish with price mentions in Australian Dollar?,3
578,tourist_attraction,reviews,"I need to check Spanish reviews, can you help me to find them?",3
579,tourist_attraction,reviews,Are there any reviews with prices in USD?,3
580,weatherapi_com,realtime_weather_api,What is the current weather?,3
581,weatherapi_com,realtime_weather_api,Can you tell me the real-time temperature right now?,3
582,weatherapi_com,realtime_weather_api,Is it going to rain in the next hour?,3
583,weatherapi_com,realtime_weather_api,What's the humidity level at the moment?,3
584,weatherapi_com,realtime_weather_api,How strong is the wind currently?,3
585,weatherapi_com,realtime_weather_api,Is there any weather alert right now?,3
586,weatherapi_com,realtime_weather_api,Can you tell me the air quality index right now?,3
587,weatherapi_com,realtime_weather_api,What is the current visibility?,3
588,weatherapi_com,realtime_weather_api,Is it cloudy outside?,3
589,weatherapi_com,realtime_weather_api,What's the weather condition right now?,3
590,weatherapi_com,forecast_weather_api,What's the weather forecast for the next week?,3
591,weatherapi_com,forecast_weather_api,Can you tell me the weather alerts for the coming days?,3
592,weatherapi_com,forecast_weather_api,What is the expected weather in Chicago?,3
593,weatherapi_com,forecast_weather_api,Any weather alerts for Paris for the upcoming time?,3
594,weatherapi_com,forecast_weather_api,Can I have the details for tomorrow's weather?,3
595,weatherapi_com,forecast_weather_api,Is there any weather alerts for the day after tomorrow?,3
596,weatherapi_com,forecast_weather_api,Can you tell me the weather in French for the next 10 days?,3
597,weatherapi_com,forecast_weather_api,Can you provide the details of the weather forecast in Spanish?,3
598,weatherapi_com,forecast_weather_api,Can you tell me the weather forecast?,3
599,weatherapi_com,forecast_weather_api,Can I have the weather alerts for the upcoming days?,3
600,weatherapi_com,ip_lookup_api,What's the geolocation of this IP?,3
601,weatherapi_com,ip_lookup_api,Can you give me information about this IP address?,3
602,weatherapi_com,ip_lookup_api,What is the Internet Service Provider for this IP?,3
603,weatherapi_com,ip_lookup_api,Is this IP address from a residential or business network?,3
604,weatherapi_com,ip_lookup_api,Can you tell me the city and country associated with an IP address?,3
605,weatherapi_com,ip_lookup_api,Where is the user with this IP located?,3
606,weatherapi_com,ip_lookup_api,What is the time zone of the person using this IP address?,3
607,weatherapi_com,ip_lookup_api,Is there any information on the organization associated with this IP?,3
608,weatherapi_com,ip_lookup_api,Can you provide any data about the usage type of this IP address?,3
609,weatherapi_com,ip_lookup_api,How do I get information about an IP address?,3
610,weatherapi_com,time_zone_api,What's the current time now?,3
611,weatherapi_com,time_zone_api,Can you tell me the time in the location I'm going to travel?,3
612,weatherapi_com,time_zone_api,"I'm in a online meeting right now, can you tell me the local time of the participants?",3
613,weatherapi_com,time_zone_api,Do you know the time difference between my place and the place I'm going to have a business trip?,3
614,weatherapi_com,time_zone_api,What is the time zone of my place?,3
615,weatherapi_com,time_zone_api,"Can you tell me the local time of my friend in another country, I don't remember his city name.",3
616,weatherapi_com,time_zone_api,What's the current time at the airport I'm heading to?,3
617,weatherapi_com,time_zone_api,Can you inform me about the local time at my next stop?,3
618,weatherapi_com,time_zone_api,"I want to check my system clock, should be there any reference?",3
619,weatherapi_com,time_zone_api,"I want to keep track of the time, can you help me?",3
620,weatherapi_com,astronomy_api,What time is sunrise in Beijing?,3
621,weatherapi_com,astronomy_api,Can you tell me the time of moonset for London?,3
622,weatherapi_com,astronomy_api,What's the moon phase in New York currently?,3
623,weatherapi_com,astronomy_api,Give me the sunrise and sunset times for Paris.,3
624,weatherapi_com,astronomy_api,Tell me about the current illumination in Sydney.,3
625,weatherapi_com,astronomy_api,"What was the moonset time for January 1, 2023?",3
626,weatherapi_com,astronomy_api,"Could you provide the sunrise time for December 25, 2023?",3
627,weatherapi_com,astronomy_api,What was the moon phase on the last Christmas?,3
628,weatherapi_com,astronomy_api,Could you tell me the time of sunrise?,3
629,weatherapi_com,astronomy_api,What was the illumination feature yesterday?,3
630,weatherapi_com,search_autocomplete_api,What's the weather like in the city I'm thinking of?,3
631,weatherapi_com,search_autocomplete_api,Can you tell me the real-time weather?,3
632,weatherapi_com,search_autocomplete_api,What's the air quality index today?,3
633,weatherapi_com,search_autocomplete_api,Are there any weather alerts right now?,3
634,weatherapi_com,search_autocomplete_api,What's the humidity level in that place?,3
635,weatherapi_com,search_autocomplete_api,How's the wind speed right now?,3
636,weatherapi_com,search_autocomplete_api,Is it raining somewhere today?,3
637,weatherapi_com,search_autocomplete_api,What's the current temperature outside?,3
638,weatherapi_com,search_autocomplete_api,Can you tell me the UV index?,3
639,weatherapi_com,search_autocomplete_api,What's the sunrise and sunset time today?,3
640,web_capture,take_image_screenshot,Could you take a screenshot of the homepage of Amazon?,3
641,web_capture,take_image_screenshot,I need a screenshot from this YouTube video.,3
642,web_capture,take_image_screenshot,Can you provide a screenshot of the Wikipedia page on Shenzhen?,3
643,web_capture,take_image_screenshot,I need a screenshot with a height of 480 pixels.,3
644,web_capture,take_image_screenshot,Can I get an image with the height of 1024px?,3
645,web_capture,take_image_screenshot,Can you provide a screenshot with a height of 768 pixels?,3
646,web_capture,take_image_screenshot,I need a screenshot with a width of 1280 pixels.,3
647,web_capture,take_image_screenshot,Can I get an image with the width of 720px?,3
648,web_capture,take_image_screenshot,Can you provide a screenshot with a width of 840 pixels?,3
649,web_capture,take_image_screenshot,Can you take a screenshot?,3
650,world_time_by_api_ninjas,v1_worldtime,"What is the current time at location 35.6832,139.5394?",3
651,world_time_by_api_ninjas,v1_worldtime,"Can you tell me what the current time is at coordinates 36.8944,104.1660?",3
652,world_time_by_api_ninjas,v1_worldtime,"What is the current time in New York, New York?",3
653,world_time_by_api_ninjas,v1_worldtime,"Could you please tell me what time it is now in Los Angeles, California?",3
654,world_time_by_api_ninjas,v1_worldtime,"What time is it currently in Paris, France?",3
655,world_time_by_api_ninjas,v1_worldtime,"Can you tell me what time it is now in London, England?",3
656,world_time_by_api_ninjas,v1_worldtime,Can I know the current time in the GMT timezone?,3
657,world_time_by_api_ninjas,v1_worldtime,I would like to know the current time in the EST timezone.,3
658,world_time_by_api_ninjas,v1_worldtime,"Can you tell me the time in Sydney, New South Wales, Australia?",3
659,world_time_by_api_ninjas,v1_worldtime,"What is the current time at location 48.8566,2.3522 in the CET timezone?",3
